{
  "id": "typescript-strict",
  "type": "rules",
  "title": "TypeScript Strict 프로젝트 규칙",
  "description": "strict 모드 TypeScript 프로젝트를 위한 Cline/Cursor 코딩 규칙. any 금지, null 안전성, ESLint 연동 등을 포함합니다.",
  "tags": ["typescript", "strict", "eslint", "frontend", "backend"],
  "tools": ["cline", "cursor"],
  "author": "team-frontend@company.com",
  "version": "1.0.0",
  "updated": "2026-03-10",
"file": ".clinerules",
  "preview": "TypeScript strict 모드 프로젝트 규칙. any 타입 사용 금지, 옵셔널 체이닝 필수, 명시적 반환 타입 선언 등을 강제합니다."
}
